{
  "$schema": "http://json-schema.org/draft-07/schema#",
  "type": "object",
  "properties": {
    "version": {
      "description": "The version number for the configuration schema",
      "oneOf": [
        {
          "type": "string"
        },
        {
          "type": "integer"
        }
      ]
    },
    "enabled-engines": {
      "description": "List of engines to enable for the data pipeline. The compiler builds deployment artifacts for the enabled engines during the build.",
      "type": "array",
      "items": {
        "type": "string",
        "enum": [
          "duckdb",
          "flink",
          "iceberg",
          "kafka",
          "postgres",
          "print",
          "redshift",
          "snowflake",
          "sparksql",
          "trino",
          "vertx"
        ]
      },
      "minItems": 1
    },
    "compiler": {
      "type": "object",
      "minProperties": 1,
      "properties": {
        "logger": {
          "type": "string"
        },
        "compile-flink-plan": {
          "type": "boolean"
        },
        "predicate-pushdown-rules": {
          "type": "string",
          "enum": ["DEFAULT", "LIMITED_TABLE_SOURCE_RULES", "LIMITED_RULES_NO_SOURCE", "LIMITED_RULES"],
          "pattern": "^[A-Z_]+$"
        },
        "extended-scalar-types": {
          "type": "boolean"
        },
        "cost-model": {
          "type": "string",
          "enum": ["DEFAULT", "READ", "WRITE"],
          "pattern": "^[A-Z_]+$"
        },
        "explain": {
          "type": "object",
          "minProperties": 1,
          "properties": {
            "visual": {
              "type": "boolean"
            },
            "physical": {
              "type": "boolean"
            },
            "logical": {
              "type": "boolean"
            },
            "text": {
              "type": "boolean"
            },
            "sorted": {
              "type": "boolean"
            },
            "sql": {
              "type": "boolean"
            }
          }
        },
        "api": {
          "type": "object",
          "properties": {
            "protocols": {
              "type": "array",
              "items": {
                "type": "string",
                "enum": ["GRAPHQL", "REST", "MCP"],
                "pattern": "^[A-Z_]+$"
              }
            },
            "endpoints": {
              "type": "string",
              "enum": ["OPS_ONLY", "GRAPHQL", "FULL"],
              "pattern": "^[A-Z_]+$"
            },
            "add-prefix": {
              "type": "boolean"
            },
            "max-result-depth": {
              "type": "integer"
            },
            "default-limit": {
              "type": "integer"
            },
            "paginated-results": {
              "type": "boolean"
            }
          },
          "additionalProperties": false
        }
      }
    },
    "script": {
      "type": "object",
      "minProperties": 1,
      "properties": {
        "main": {
          "type": "string"
        },
        "database": {
          "type": "string"
        },
        "graphql": {
          "type": "string"
        },
        "operations": {
          "type": "array",
          "items": { "type": "string" }
        },
        "api": {
          "type": "object",
          "minProperties": 1,
          "patternProperties": {
            "^v[0-9]+$": {
              "type": "object",
              "minProperties": 1,
              "properties": {
                "schema": {
                  "type": "string"
                },
                "operations": {
                  "type": "array",
                  "items": { "type": "string" }
                },
                "openapi": {
                  "type": "string"
                }
              },
              "additionalProperties": false,
              "anyOf": [
                { "required": ["schema"] },
                { "required": ["operations"] },
                { "required": ["openapi"] }
              ]
            }
          },
          "additionalProperties": false
        },
        "config":{
          "type": "object",
          "minProperties": 1,
          "additionalProperties": true
        },
        "include": {
          "type": "object",
          "minProperties": 1,
          "patternProperties": {
            "^[A-Za-z0-9_-]+$": {
              "type": "object",
              "minProperties": 1,
              "properties": {
                "package": {
                  "type": "string"
                },
                "config": {
                  "type": "object",
                  "minProperties": 1,
                  "additionalProperties": true
                },
                "standalone": {
                  "type": "boolean"
                }
              },
              "additionalProperties": false,
              "required": ["package"]
            }
          },
          "additionalProperties": false
        }
      },
      "additionalProperties": false,
      "allOf": [
        {
          "not": {
            "required": ["api", "graphql"]
          }
        },
        {
          "not": {
            "required": ["api", "operations"]
          }
        }
      ]
    },
    "engines": {
      "type": "object",
      "minProperties": 1,
      "properties": {
        "flink": {
          "type": "object",
          "minProperties": 1,
          "properties": {
            "config": {
              "type": "object",
              "minProperties": 1
            },
            "deployment": {
              "type": "object",
              "additionalProperties": true
            }
          },
          "additionalProperties": false
        },
        "duckdb": {
          "type": "object",
          "properties": {
            "url": {
              "type": "string"
            },
            "memory-limit": {
              "type": "string"
            },
            "use-disk-cache": {
              "type": "boolean"
            },
            "use-version-guessing": {
              "type": "boolean"
            },
            "scan-cte-cardinality-divisor": {
              "type": "integer",
              "exclusiveMinimum": 0
            }
          },
          "additionalProperties": false,
          "required": ["url"]
        },
        "trino": {
          "type": "object",
          "properties": {
            "view-catalog": {
              "type": "string"
            },
            "view-schema": {
              "type": "string"
            }
          },
          "additionalProperties": false
        },
        "redshift": {
          "type": "object",
          "properties": {
            "view-database": {
              "type": "string"
            },
            "view-schema": {
              "type": "string"
            }
          },
          "additionalProperties": false
        },
        "sparksql": {
          "type": "object",
          "properties": {
            "view-catalog": {
              "type": "string"
            },
            "view-database": {
              "type": "string"
            }
          },
          "additionalProperties": false
        },
        "snowflake": {
          "type": "object",
          "properties": {
            "catalog-name": {
              "type": "string"
            },
            "external-volume": {
              "type": "string"
            },
            "url": {
              "type": "string"
            }
          },
          "required": ["catalog-name", "external-volume", "url"],
          "additionalProperties": false
        },
        "vertx": {
          "type": "object",
          "properties": {
            "authKind": {
              "description": "List of enabled authentication methods.",
              "type": "array",
              "items": {
                "type": "string",
                "enum": ["JWT", "OAUTH"]
              },
              "uniqueItems": true
            },
            "config": {
              "type": "object",
              "minProperties": 1
            },
            "deployment": {
              "type": "object",
              "additionalProperties": true
            }
          },
          "additionalProperties": false
        },
        "postgres": {
          "type": "object",
          "properties": {
            "partition-ttl-divisor": {
              "description": "Divisor applied to a table's TTL to cap the number of pg_partman partitions.",
              "type": "integer"
            },
            "partition-premake": {
              "description": "Number of future partitions pg_partman pre-creates ahead of the current one (p_premake).",
              "type": "integer"
            },
            "config": {
              "type": "object",
              "minProperties": 1
            },
            "deployment": {
              "type": "object",
              "additionalProperties": true
            }
          },
          "additionalProperties": false
        },
        "kafka": {
          "type": "object",
          "properties": {
            "retention": {
              "oneOf": [
                {
                  "type": "string"
                },
                {
                  "type": "null"
                }
              ]
            },
            "watermark": {
              "type": "string"
            },
            "transaction-watermark": {
              "type": "string"
            },
            "use-source-watermark": {
              "type": "boolean"
            },
            "use-transaction-source-watermark": {
              "type": "boolean"
            },
            "num-partitions": {
              "type": "integer"
            },
            "replication-factor": {
              "type": "integer"
            }
          },
          "additionalProperties": false
        }
      },
      "additionalProperties": false
    },
    "connectors": {
      "type": "object",
      "minProperties": 1
    },
    "package": {
      "description": "Deprecated, do not use anymore",
      "type": "object",
      "minProperties": 1
    },
    "information": {
      "description": "Information about this DataSQRL project/deployment",
      "type": "object",
      "properties": {
        "description": {
          "description": "Describes what is being deployed",
          "type": "string"
        },
        "label": {
          "description": "Labels individual deployments for this project",
          "type": "string"
        }
      },
      "minProperties": 1
    },
    "test-runner": {
      "type": "object",
      "minProperties": 1,
      "properties": {
        "snapshot-folder": {
          "type": "string"
        },
        "test-folder": {
          "type": "string"
        },
        "use-inferred-schema": {
          "type": "boolean"
        },
        "delay-sec": {
          "type": "integer"
        },
        "mutation-delay-sec": {
          "type": "integer"
        },
        "required-checkpoints": {
          "type": "integer"
        },
        "headers": {
          "type": "object",
          "minProperties": 1
        },
        "create-topics": {
          "type": "array",
          "items": { "type": "string" },
          "minItems": 1
        }
      },
      "additionalProperties": false
    }
  },
  "additionalProperties": false
}
