{
  "version": "1",
  "enabled-engines": ["vertx", "postgres", "flink"],
  "compiler": {
    "api": {
      "paginated-results": true
    }
  },
  "script": {
    "main": "clickstream-teaser.sqrl"
  },
  "test-runner": {
    "snapshot-folder": "snapshots-clickstream-teaser",
    "test-folder": "tests-clickstream-teaser",
    "delay-sec": -1
  }
}
