{
  "version": "1",
  "enabled-engines": ["vertx", "postgres", "kafka", "flink"],
  "compiler": {
    "logger": "print",
    "compile-flink-plan": true,
    "extended-scalar-types": true,
    "predicate-pushdown-rules": "LIMITED_RULES_NO_SOURCE",
    "cost-model": "DEFAULT",
    "explain": {
      "sql": false,
      "logical": false,
      "physical": false,
      "sorted": true
    },
    "api": {
      "protocols": ["GRAPHQL", "REST", "MCP"],
      "endpoints": "FULL",
      "add-prefix": true,
      "max-result-depth": 3,
      "default-limit": 10,
      "paginated-results": false
    }
  },
  "engines": {
    "flink": {
      "config": {
        "execution.runtime-mode": "STREAMING",
        "security.delegation.tokens.enabled": false,
        "state.backend.type": "rocksdb"
      }
    },
    "duckdb": {
      "url": "jdbc:duckdb:",
      "scan-cte-cardinality-divisor": 1
    },
    "postgres": {
      "partition-ttl-divisor": 100,
      "partition-premake": 4
    },
    "kafka": {
      "retention": null,
      "use-source-watermark": false,
      "use-transaction-source-watermark": false,
      "watermark": "0 ms",
      "transaction-watermark": "0 ms",
      "num-partitions": 1,
      "replication-factor": 3
    }
  },
  "connectors": {
    "kafka-mutation": {
      "connector": "kafka-safe",
      "format": "flexible-json",
      "flexible-json.timestamp-format.standard": "ISO-8601",
      "properties.bootstrap.servers": "${KAFKA_BOOTSTRAP_SERVERS}",
      "properties.group.id": "${KAFKA_GROUP_ID}",
      "properties.auto.offset.reset": "earliest",
      "properties.compression.type": "zstd",
      "topic": "${sqrl:table-name}"
    },
    "kafka": {
      "connector": "kafka-safe",
      "format": "flexible-json",
      "flexible-json.timestamp-format.standard": "ISO-8601",
      "properties.bootstrap.servers": "${KAFKA_BOOTSTRAP_SERVERS}",
      "properties.group.id": "${KAFKA_GROUP_ID}",
      "properties.compression.type": "zstd",
      "topic": "${sqrl:table-name}"
    },
    "iceberg": {
      "connector": "iceberg",
      "catalog-name": "default_catalog",
      "catalog-table": "${sqrl:table-name}",
      "warehouse": "sqrl_iceberg_data",
      "format-version": 2,
      "write.distribution-mode": "hash",
      "commit.retry.num-retries": "20",
      "commit.retry.min-wait-ms": "100",
      "commit.retry.max-wait-ms": "5000"
    },
    "iceberg-maintenance": {
      "compaction.enabled": "true",
      "write.metadata.delete-after-commit.enabled": "true",
      "write.metadata.previous-versions-max": "10",
      "history.expire.max-snapshot-age-ms": "86400000"
    },
    "postgres": {
      "connector": "jdbc-sqrl",
      "username": "${POSTGRES_USERNAME}",
      "password": "${POSTGRES_PASSWORD}",
      "url": "jdbc:postgresql://${POSTGRES_AUTHORITY}",
      "driver": "org.postgresql.Driver",
      "table-name": "${sqrl:table-name}"
    },
    "print": {
      "connector": "print",
      "print-identifier": "${sqrl:table-name}"
    }
  },
  "test-runner": {
    "snapshot-folder": "./snapshots",
    "test-folder": "./tests",
    "use-inferred-schema": true,
    "delay-sec": 30,
    "mutation-delay-sec": 0,
    "required-checkpoints": 0
  }
}
